{
  "schemaVersion": "1.1",
  "packId": "gcse_geo_p1_physical_environment_november_2020",
  "subject": "geography",
  "title": "AQA GCSE Geography November 2020 — Paper 1: Living with the Physical Environment",
  "sourceLanguageCode": "en-GB",
  "targetLanguageCode": "en-GB",
  "speechLanguage": "en-GB",
  "items": [
    {
      "id": "gcse_geo_p1_physical_environment_november_2020_q1_1_kw",
      "type": "vocab",
      "level": "GCSE Year 10-11",
      "topics": [
        "The challenge of natural hazards",
        "The living world",
        "Physical landscapes in the UK"
      ],
      "tags": [
        "GCSE",
        "geography",
        "AQA",
        "november-2020"
      ],
      "data": {
        "partOfSpeech": "keyword",
        "sourceWord": "Q1.1: Which one of the following statements about tropical storms is true? (1 marks)",
        "targetWord": "Shade one circle only. D. Tropical storms form above oceans where temperatures are over 27°C | Shade one circle only | D. Tropical storms form above oceans where temperatures are over 27°C",
        "examples": {
          "en-GB": "AQA GCSE Geography November 2020 — Paper 1: Living with the Physical Environment"
        }
      }
    },
    {
      "id": "gcse_geo_p1_physical_environment_november_2020_q1_10_kw",
      "type": "vocab",
      "level": "GCSE Year 10-11",
      "topics": [
        "The challenge of natural hazards",
        "The living world",
        "Physical landscapes in the UK"
      ],
      "tags": [
        "GCSE",
        "geography",
        "AQA",
        "november-2020"
      ],
      "data": {
        "partOfSpeech": "keyword",
        "sourceWord": "Q1.10: State one source of evidence for long-term climate change during the Quaternary period. (1 marks)",
        "targetWord": "Quaternary period. Ice cores (which show CO² and methane concentrations) . Evidence from ocean sediments/rocks/ fossils/plankton (helps to show temperature changes) . Pollen analysis. Credit other valid answers | Quaternary period | Ice cores (which show CO² and methane concentrations) | Evidence from ocean sediments/rocks/ fossils/plankton (helps to show | temperature changes) | Pollen analysis",
        "examples": {
          "en-GB": "AQA GCSE Geography November 2020 — Paper 1: Living with the Physical Environment"
        }
      }
    },
    {
      "id": "gcse_geo_p1_physical_environment_november_2020_q1_11_kw",
      "type": "vocab",
      "level": "GCSE Year 10-11",
      "topics": [
        "The challenge of natural hazards",
        "The living world",
        "Physical landscapes in the UK"
      ],
      "tags": [
        "GCSE",
        "geography",
        "AQA",
        "november-2020"
      ],
      "data": {
        "partOfSpeech": "keyword",
        "sourceWord": "Q1.11: Using Figure 5, which one of the following statements is true? (1 marks)",
        "targetWord": "Shade one circle only. D Areas north of 60°N will have the greatest increase in temperature | Shade one circle only | D Areas north of 60°N will have the greatest increase in temperature",
        "examples": {
          "en-GB": "AQA GCSE Geography November 2020 — Paper 1: Living with the Physical Environment"
        }
      }
    },
    {
      "id": "gcse_geo_p1_physical_environment_november_2020_q1_12_kw",
      "type": "vocab",
      "level": "GCSE Year 10-11",
      "topics": [
        "The challenge of natural hazards",
        "The living world",
        "Physical landscapes in the UK"
      ],
      "tags": [
        "GCSE",
        "geography",
        "AQA",
        "november-2020"
      ],
      "data": {
        "partOfSpeech": "keyword",
        "sourceWord": "Q1.12: ‘Managing climate change involves both reducing causes (mitigation) and responding to change (adaptation).’ Do you agree? Explain your answer. Use Figure 6 and your own understanding. (9 marks)",
        "targetWord": "Knowledge of mitigation strategies. Consists of actions to limit the magnitude or rate of long-term global warming. Mitigation involves reductions in human emissions of greenhouse gases. It may also be achieved by increasing the capacity of carbon sinks, eg, through reforestation | Knowledge of adaptation strategies. Action taken to help communities and ecosystems cope with changing climate. The goal is to reduce vulnerability to the harmful effects of climate change (like sea-level rise, more intense extreme weather events or food insecurity). It may also involve making the most of any opportunities (for example, longer growing seasons or increased yields in some regions) | Understanding of mitigation strategies shown in Figure 6: Alternative energy. To help reduce carbon emissions, alternative sources of energy such as hydro-electricity, nuclear power, solar, wind, and tides are increasing in importance. Most are renewable. Nuclear power uses uranium to generate electricity but oes not emit CO2 as a by-product. Carbon capture and storage uses technology to capture CO2 produced from the use of fossil fuels in electricity generation and industrial processes and safely storing it. Carbon ioxide from atmosphere can be converted into liquid and injected into sedimentary rock. It may be possible to capture up to 90 per cent of the CO2 that would otherwise enter the atmosphere | Understanding of other mitigation strategies. Planting trees. Trees act as carbon sinks, removing CO2 from the atmosphere by the process of photosynthesis. They also release moisture into the atmosphere. This has a cooling effect by producing more cloud, reducing incoming solar radiation. International agreements. The UN negotiated a new international climate change agreement for all countries at the 2015 Paris climate conference. It will be implemented from 2020. Aim is to reduce global emissions by at least 40 per cent below 2010 levels by 2030, and by 60 per cent by 2050. Intention to keep global temperature increase below 2°C. Credit reference to other climate conferences, including Madrid 2019. Low level mitigation measures include cutting own on food waste and increasing recycling, introducing energy-saving measures at home, walking or cycling instead of taking the car, buying local food to cut own on food miles | Understanding of adaptation strategies shown in Figure 6. Agriculture – farmers will have to adapt as some crops may not be able to grow in a warmer or rier climate, however, rought resistant plants may be grown where rainfall is lower and other crops (eg oranges and grapes) will be able to be planted. Cultivation might be shifted to new areas and irrigation increased as rainfall patterns change. Adjusting to rising sea levels – areas at risk from sea level rise may use sea efences to protect the land from being eroded away. Houses built on stilts may help to protect properties in vulnerable areas. Understanding of other adaptation strategies, such as Water supply – water transfer schemes could be used, moving water from an area of water surplus to an area of water shortage. Better management of water resources to ensure evaporation and loss are kept to a minimum. Some countries are installing esalinisation plants to cope with water supply problems. Credit examples of mitigation and adaptation strategies | Evaluation of the importance of both strategies. Mitigation addresses the root causes, by reducing greenhouse gas emissions, while adaptation seeks to lower the risks posed by the consequences of climatic changes. Both approaches will be necessary, because even if emissions are ramatically ecreased in the next 20–30 years, adaptation will still be needed to eal with the global changes that have already started. High performance Intermediate performance Threshold performance o not significantly hinder meaning overall",
        "examples": {
          "en-GB": "AQA GCSE Geography November 2020 — Paper 1: Living with the Physical Environment"
        }
      }
    },
    {
      "id": "gcse_geo_p1_physical_environment_november_2020_q1_2_kw",
      "type": "vocab",
      "level": "GCSE Year 10-11",
      "topics": [
        "The challenge of natural hazards",
        "The living world",
        "Physical landscapes in the UK"
      ],
      "tags": [
        "GCSE",
        "geography",
        "AQA",
        "november-2020"
      ],
      "data": {
        "partOfSpeech": "keyword",
        "sourceWord": "Q1.2: The total number of typhoons reaching Japan was 204. What percentage of the total number of typhoons occurred in August? Give your answer to the nearest whole percentage. (2 marks)",
        "targetWord": "What percentage of the total number of typhoons occurred in August? Give your answer to the nearest whole percentage. 34% **** Working and units not needed. Allow 1 mark for evidence of correct working even if final answer is wrong. Allow maximum 1 mark if figure expressed with 1–2 ecimal places (33.8 or 33.82) | What percentage of the total number of typhoons occurred in August? | Give your answer to the nearest whole percentage | 34% **** Working and units not needed",
        "examples": {
          "en-GB": "AQA GCSE Geography November 2020 — Paper 1: Living with the Physical Environment"
        }
      }
    },
    {
      "id": "gcse_geo_p1_physical_environment_november_2020_q1_3_kw",
      "type": "vocab",
      "level": "GCSE Year 10-11",
      "topics": [
        "The challenge of natural hazards",
        "The living world",
        "Physical landscapes in the UK"
      ],
      "tags": [
        "GCSE",
        "geography",
        "AQA",
        "november-2020"
      ],
      "data": {
        "partOfSpeech": "keyword",
        "sourceWord": "Q1.3: Give one reason why tropical storms have a seasonal pattern. (1 marks)",